<?xml version="1.0" encoding="UTF-8"?>
<xs:schema xmlns:xs="http://www.w3.org/2001/XMLSchema" elementFormDefault="qualified">
  <xs:element name="alumnos">
    <xs:complexType>
      <xs:sequence>
        <xs:element name="alumno" maxOccurs="unbounded">
          <xs:complexType>
            <xs:sequence>
              <xs:element name="cod">
                <xs:simpleType>
                  <xs:restriction base="xs:integer">
                    <xs:minInclusive value="100"/>
                    <xs:maxInclusive value="10000"/>
                  </xs:restriction>
                </xs:simpleType>
              </xs:element>
              <xs:element name="apellido" minOccurs="1" maxOccurs="2">
                <xs:simpleType>
                  <xs:restriction base="xs:string">
                          <xs:minLength value="1"/>
                          <xs:maxLength value="60"/>
                  </xs:restriction>
                </xs:simpleType>
              </xs:element>
              <xs:element name="nombre">
                <xs:simpleType>
                  <xs:restriction base="xs:string">
                    <xs:minLength value="1"/>
                    <xs:maxLength value="30"/>
                  </xs:restriction>
                </xs:simpleType>
              </xs:element>
              <xs:element name="direccion">
                <xs:simpleType>
                  <xs:restriction base="xs:string">
                    <xs:minLength value="5"/>
                    <xs:maxLength value="75"/>
                  </xs:restriction>
                </xs:simpleType>
              </xs:element>
              <xs:element name="telefono">
                <xs:simpleType>
                  <xs:restriction base="xs:string">
                    <xs:length value="12"/>
                  </xs:restriction>
                </xs:simpleType>
              </xs:element>
            </xs:sequence>
          </xs:complexType>
        </xs:element>
      </xs:sequence>
    </xs:complexType>
  </xs:element>
</xs:schema>
